{
    "type":"LocareJSON",
    "version":"1.0.0",
    "metadata":{
       "commonCoordinateSpaceVersion":"https://openminds.ebrains.eu/instances/commonCoordinateSpaceVersion/AMB-CCF_v3",
       "sourcePublication":"https://doi.org/10.25493/AWS5-MZG"
    },
    "LocareCollection": [
    {
          "geometry":{
             "type":"Point",
             "coordinates":[
                143.4,
                200.9,
                191.3
             ]
          },
          "properties":{
             "name":"EP23HI-LP2",
             "description":"position of neuronal somata centroid representing data from sourcePublication, in subfolder LP2 of EP23HI"
        }
    }  
  ]  
}