{
  "type":"LocareJSON",
  "version":"1.0.0",
  "metadata":{
      "commonCoordinateSpaceVersion": "https://openminds.ebrains.eu/instances/commonCoordinateSpaceVersion/AMB-CCF_v3",
      "sourcePublication": "https://doi.org/10.25493/AWS5-MZG"
  },
  "LocareCollection": [
   {
      "atlasMeshAssociation":{
          "parcellationEntityVersion": "https://openminds.ebrains.eu/instances/parcellationEntityVersion/AMBA_CCFv3-2017_ventralPosterolateralNucleusOfTheThalamus"
      },  
      "properties":{
          "name":"HBP14-VPL3",
          "description":"data shared from sourcePublication, in subfolder VPL3 of HBP14, is associated to ventral posterolateral nucleus of the thalamus (VPL)"
      }   
   }
  ]
}